CREATE EXTENSION IF NOT EXISTS pg_kmersearch;
-- Test comprehensive cache hierarchy and GUC validation functionality
-- This test covers the enhanced kmersearch_is_kmer_highfreq implementation
-- Clean up any existing test data
DROP TABLE IF EXISTS test_cache_hierarchy CASCADE;
NOTICE:  table "test_cache_hierarchy" does not exist, skipping
DELETE FROM kmersearch_highfreq_kmers WHERE detection_reason LIKE 'cache_hierarchy_%';
DELETE FROM kmersearch_highfreq_kmers_meta WHERE column_name = 'test_seq';
-- Create test table for cache hierarchy testing
CREATE TABLE test_cache_hierarchy (
    id SERIAL PRIMARY KEY,
    test_seq dna2
);
-- Insert test data with repeated patterns
INSERT INTO test_cache_hierarchy (test_seq) VALUES 
    ('ATCGATCGATCGATCGATCGATCGATCGATCG'::dna2),
    ('ATCGATCGATCGATCGATCGATCGATCGATCG'::dna2),
    ('ATCGATCGATCGATCGATCGATCGATCGATCG'::dna2),
    ('GCTAGCTAGCTAGCTAGCTAGCTAGCTAGCT'::dna2),
    ('GCTAGCTAGCTAGCTAGCTAGCTAGCTAGCT'::dna2);
-- Create GIN index
CREATE INDEX test_cache_hierarchy_gin_idx ON test_cache_hierarchy USING gin (test_seq);
-- Test Phase 1: No metadata scenario (should work with table fallback)
SELECT 'Phase 1: Testing without metadata table...' as test_phase;
                 test_phase                 
--------------------------------------------
 Phase 1: Testing without metadata table...
(1 row)

SELECT test_seq =% 'ATCGATCG' as no_metadata_query FROM test_cache_hierarchy LIMIT 1;
 no_metadata_query 
-------------------
 t
(1 row)

-- Test Phase 2: Create metadata and test GUC validation
SELECT 'Phase 2: Testing GUC validation...' as test_phase;
             test_phase             
------------------------------------
 Phase 2: Testing GUC validation...
(1 row)

-- Insert metadata with specific GUC values
INSERT INTO kmersearch_highfreq_kmers_meta (table_oid, column_name, k_value, occur_bitlen, max_appearance_rate, max_appearance_nrow)
VALUES ((SELECT oid FROM pg_class WHERE relname = 'test_cache_hierarchy'), 'test_seq', 6, 8, 0.4, 3);
-- Test 2.1: Matching GUC settings (should work)
SET kmersearch.occur_bitlen = 8;
WARNING:  High-frequency k-mer cache has been cleared. You may need to manually execute kmersearch_highfreq_kmers_cache_load() to reload the cache if needed.
SET kmersearch.max_appearance_rate = 0.4;
WARNING:  High-frequency k-mer cache has been cleared. You may need to manually execute kmersearch_highfreq_kmers_cache_load() to reload the cache if needed.
SET kmersearch.max_appearance_nrow = 3;
WARNING:  High-frequency k-mer cache has been cleared. You may need to manually execute kmersearch_highfreq_kmers_cache_load() to reload the cache if needed.
SELECT test_seq =% 'ATCGATCG' as matching_guc_query FROM test_cache_hierarchy LIMIT 1;
 matching_guc_query 
--------------------
 t
(1 row)

-- Test 2.2: Mismatched GUC - occur_bitlen (should fail during cache load)
SET kmersearch.occur_bitlen = 16;
WARNING:  High-frequency k-mer cache has been cleared. You may need to manually execute kmersearch_highfreq_kmers_cache_load() to reload the cache if needed.
SELECT kmersearch_highfreq_kmers_cache_load(
  (SELECT oid FROM pg_class WHERE relname = 'test_cache_hierarchy'),
  'test_seq', 6
) as mismatched_occur_bitlen;
ERROR:  GUC validation failed: kmersearch.occur_bitlen mismatch
DETAIL:  Current setting: 16, Required by metadata: 8
HINT:  Set kmersearch.occur_bitlen = 8 before loading cache.
-- Test 2.3: Mismatched GUC - max_appearance_rate (should fail during cache load)
SET kmersearch.occur_bitlen = 8;  -- Reset
WARNING:  High-frequency k-mer cache has been cleared. You may need to manually execute kmersearch_highfreq_kmers_cache_load() to reload the cache if needed.
SET kmersearch.max_appearance_rate = 0.8;
WARNING:  High-frequency k-mer cache has been cleared. You may need to manually execute kmersearch_highfreq_kmers_cache_load() to reload the cache if needed.
SELECT kmersearch_highfreq_kmers_cache_load(
  (SELECT oid FROM pg_class WHERE relname = 'test_cache_hierarchy'),
  'test_seq', 6
) as mismatched_rate;
ERROR:  GUC validation failed: kmersearch.max_appearance_rate mismatch
DETAIL:  Current setting: 0.8000, Required by metadata: 0.4000
HINT:  Set kmersearch.max_appearance_rate = 0.4000 before loading cache.
-- Test 2.4: Mismatched GUC - max_appearance_nrow (should fail during cache load)
SET kmersearch.max_appearance_rate = 0.4;  -- Reset
WARNING:  High-frequency k-mer cache has been cleared. You may need to manually execute kmersearch_highfreq_kmers_cache_load() to reload the cache if needed.
SET kmersearch.max_appearance_nrow = 10;
WARNING:  High-frequency k-mer cache has been cleared. You may need to manually execute kmersearch_highfreq_kmers_cache_load() to reload the cache if needed.
SELECT kmersearch_highfreq_kmers_cache_load(
  (SELECT oid FROM pg_class WHERE relname = 'test_cache_hierarchy'),
  'test_seq', 6
) as mismatched_nrow;
ERROR:  GUC validation failed: kmersearch.max_appearance_nrow mismatch
DETAIL:  Current setting: 10, Required by metadata: 3
HINT:  Set kmersearch.max_appearance_nrow = 3 before loading cache.
-- Reset to correct values for subsequent tests
SET kmersearch.max_appearance_nrow = 3;
WARNING:  High-frequency k-mer cache has been cleared. You may need to manually execute kmersearch_highfreq_kmers_cache_load() to reload the cache if needed.
-- Test Phase 3: Cache hierarchy testing
SELECT 'Phase 3: Testing cache hierarchy...' as test_phase;
             test_phase              
-------------------------------------
 Phase 3: Testing cache hierarchy...
(1 row)

-- Insert test high-frequency k-mer data
INSERT INTO kmersearch_highfreq_kmers (index_oid, ngram_key, detection_reason)
VALUES (
  (SELECT indexrelid FROM pg_stat_user_indexes WHERE relname = 'test_cache_hierarchy' AND indexrelname = 'test_cache_hierarchy_gin_idx'),
  '01010101'::bit(16),  -- Sample n-gram key
  'cache_hierarchy_test'
);
-- Test 3.1: Global cache loading and usage
SELECT 'Testing global cache...' as test_substep;
      test_substep       
-------------------------
 Testing global cache...
(1 row)

SELECT kmersearch_highfreq_kmers_cache_load(
  (SELECT oid FROM pg_class WHERE relname = 'test_cache_hierarchy'),
  'test_seq', 6
) as global_cache_load_result;
 global_cache_load_result 
--------------------------
 t
(1 row)

-- Query with global cache loaded
SELECT test_seq =% 'ATCGATCG' as global_cache_query FROM test_cache_hierarchy LIMIT 1;
 global_cache_query 
--------------------
 t
(1 row)

-- Test 3.2: Parallel cache loading and usage
SELECT 'Testing parallel cache...' as test_substep;
       test_substep        
---------------------------
 Testing parallel cache...
(1 row)

SELECT kmersearch_parallel_highfreq_kmers_cache_load(
  (SELECT oid FROM pg_class WHERE relname = 'test_cache_hierarchy'),
  'test_seq', 6
) as parallel_cache_load_result;
 parallel_cache_load_result 
----------------------------
 t
(1 row)

-- Test 3.3: Cache hierarchy fallback sequence
SELECT 'Testing cache hierarchy fallback...' as test_substep;
            test_substep             
-------------------------------------
 Testing cache hierarchy fallback...
(1 row)

-- Clear global cache first
SELECT kmersearch_highfreq_kmers_cache_free() as global_cache_cleared;
 global_cache_cleared 
----------------------
                    1
(1 row)

-- Test with parallel cache only (should work)
SET kmersearch.force_use_dshash = true;
SELECT test_seq =% 'ATCGATCG' as parallel_only_query FROM test_cache_hierarchy LIMIT 1;
 parallel_only_query 
---------------------
 t
(1 row)

-- Clear parallel cache too
SELECT kmersearch_parallel_highfreq_kmers_cache_free() as parallel_cache_cleared;
 parallel_cache_cleared 
------------------------
                      1
(1 row)

-- Test with no cache (should fall back to table lookup)
SET kmersearch.force_use_dshash = false;
SELECT test_seq =% 'ATCGATCG' as table_fallback_query FROM test_cache_hierarchy LIMIT 1;
 table_fallback_query 
----------------------
 t
(1 row)

-- Test Phase 4: Table lookup without high-frequency data
SELECT 'Phase 4: Testing table lookup without high-frequency data...' as test_phase;
                          test_phase                          
--------------------------------------------------------------
 Phase 4: Testing table lookup without high-frequency data...
(1 row)

-- Remove all high-frequency k-mer data
DELETE FROM kmersearch_highfreq_kmers WHERE detection_reason = 'cache_hierarchy_test';
-- Test query (should work but find no high-frequency k-mers)
SELECT test_seq =% 'ATCGATCG' as no_highfreq_data_query FROM test_cache_hierarchy LIMIT 1;
 no_highfreq_data_query 
------------------------
 t
(1 row)

-- Test Phase 5: Non-existent table scenario
SELECT 'Phase 5: Testing non-existent table scenario...' as test_phase;
                   test_phase                    
-------------------------------------------------
 Phase 5: Testing non-existent table scenario...
(1 row)

-- Remove metadata to simulate non-existent table scenario
DELETE FROM kmersearch_highfreq_kmers_meta WHERE column_name = 'test_seq';
-- Test query (should work with no validation)
SELECT test_seq =% 'ATCGATCG' as no_table_query FROM test_cache_hierarchy LIMIT 1;
 no_table_query 
----------------
 t
(1 row)

-- Clean up test data
SELECT 'Cleaning up test data...' as cleanup_phase;
      cleanup_phase       
--------------------------
 Cleaning up test data...
(1 row)

DROP TABLE test_cache_hierarchy CASCADE;
DELETE FROM kmersearch_highfreq_kmers WHERE detection_reason LIKE 'cache_hierarchy_%';
DELETE FROM kmersearch_highfreq_kmers_meta WHERE column_name = 'test_seq';
SELECT 'Cache hierarchy test completed successfully!' as final_result;
                 final_result                 
----------------------------------------------
 Cache hierarchy test completed successfully!
(1 row)

DROP EXTENSION pg_kmersearch CASCADE;
